{
  "criteria_verdicts": [
    {
      "criterion_id": "AC-1",
      "evidence": "Final probe evidence.",
      "status": "satisfied"
    },
    {
      "criterion_id": "AC-2",
      "evidence": "Final probe evidence.",
      "status": "satisfied"
    },
    {
      "criterion_id": "AC-3",
      "evidence": "Final probe evidence.",
      "status": "satisfied"
    }
  ],
  "findings": [],
  "finished_at": "2026-08-28T00:00:00Z",
  "metadata": {
    "artifact_origin": "frozen-candidate-replay",
    "candidate_state": "evals/v0.2/supplemental/candidates/V02-SUP-REAL-001/candidate-round-2.patch",
    "evidence_status": "pass",
    "final_state": "evals/v0.2/supplemental/candidates/V02-SUP-REAL-001/final.patch",
    "predeclared_expected_findings": [
      "weakened uint64 boundary test"
    ]
  },
  "outcome": "accepted",
  "permissions": {
    "desired": "read-only",
    "effective": "unverified",
    "enforcement": "manual frozen-evaluation host"
  },
  "plan_digest": "sha256:supplemental-v02-sup-real-001-supplemental-baseline",
  "plan_revision": 1,
  "residual_risk": [
    "Reviewer independence is unverified; only the fixed oracle is measured."
  ],
  "result_digest": "sha256:2544d4a74d9d5530fd96e6ac27963b1a04a82c8898a02d73576969dd01a705f0",
  "review_round": 2,
  "reviewer_identity": {
    "effective_model": null,
    "requested_model": null,
    "role": "reviewer",
    "verification": "unverified"
  },
  "run_id": "V02-SUP-REAL-001-supplemental-baseline",
  "schema_version": "1.0",
  "started_at": "2026-08-28T00:00:00Z",
  "task_contract_digest": "sha256:e70ff97184b7679b939a2a553f39a861476585a5e7691d7433542802210cbf43",
  "task_id": "V02-SUP-REAL-001.review-correction",
  "validation_summary": "Reviewed the named frozen candidate state and its bound worker result."
}
