{
  "criteria_verdicts": [
    {
      "criterion_id": "AC-1",
      "evidence": "Candidate requires disposition.",
      "status": "unverified"
    },
    {
      "criterion_id": "AC-2",
      "evidence": "Candidate requires disposition.",
      "status": "unverified"
    },
    {
      "criterion_id": "AC-3",
      "evidence": "Candidate requires disposition.",
      "status": "unverified"
    }
  ],
  "findings": [
    {
      "correction": "Provide only the bounded correction.",
      "disposition": "worker",
      "evidence": "silent truncation",
      "id": "F-ROUND-1",
      "impact": "Frozen candidate cannot satisfy the task.",
      "path": "evals/v0.2/supplemental/candidates/V02-SUP-REAL-002/candidate-round-1.patch",
      "severity": "high",
      "type": "acceptance-failure"
    }
  ],
  "finished_at": "2026-08-28T00:00:00Z",
  "metadata": {
    "artifact_origin": "frozen-candidate-replay",
    "bound_patch_digest": "sha256:96e3df8a9680cd927ecc175937e7349359b6b17fecc0da3d76edd8068f969f10",
    "bound_patch_path": "evals/v0.2/supplemental/candidates/V02-SUP-REAL-002/candidate-round-1.patch",
    "candidate_state": "evals/v0.2/supplemental/candidates/V02-SUP-REAL-002/candidate-round-1.patch",
    "predeclared_expected_findings": [
      "silent truncation"
    ]
  },
  "outcome": "changes_requested",
  "permissions": {
    "desired": "read-only",
    "effective": "unverified",
    "enforcement": "manual frozen-evaluation host"
  },
  "plan_digest": "sha256:supplemental-v02-sup-real-002-supplemental-v0.2",
  "plan_revision": 1,
  "residual_risk": [
    "Reviewer independence is unverified; only the fixed oracle is measured."
  ],
  "result_digest": "sha256:fd666835cb980b0bebfd945e12d2f24aff16b0d33c17fe9ec1ddd4d14d8d85f8",
  "review_round": 1,
  "reviewer_identity": {
    "effective_model": null,
    "requested_model": null,
    "role": "reviewer",
    "verification": "unverified"
  },
  "run_id": "V02-SUP-REAL-002-supplemental-v0.2",
  "schema_version": "1.0",
  "started_at": "2026-08-28T00:00:00Z",
  "task_contract_digest": "sha256:c2c66724c409e6b37e6e6fc038782c173d6c51ef9984ac62415d1dbdd7f3f6b0",
  "task_id": "V02-SUP-REAL-002.review-correction",
  "validation_summary": "Reviewed the named frozen candidate state and its bound worker result."
}
