{
  "criteria_verdicts": [
    {
      "criterion_id": "AC-1",
      "evidence": "Candidate requires disposition.",
      "status": "unverified"
    },
    {
      "criterion_id": "AC-2",
      "evidence": "Candidate requires disposition.",
      "status": "unverified"
    },
    {
      "criterion_id": "AC-3",
      "evidence": "Candidate requires disposition.",
      "status": "unverified"
    }
  ],
  "findings": [
    {
      "correction": "Provide only the bounded correction.",
      "disposition": "architect",
      "evidence": "missing upper-bound guard",
      "id": "F-ROUND-2",
      "impact": "Frozen candidate cannot satisfy the task.",
      "path": "evals/v0.2/supplemental/candidates/V02-SUP-FIX-01/candidate-round-2.patch",
      "severity": "high",
      "type": "acceptance-failure"
    }
  ],
  "finished_at": "2026-08-28T00:00:00Z",
  "metadata": {
    "artifact_origin": "frozen-candidate-replay",
    "candidate_state": "evals/v0.2/supplemental/candidates/V02-SUP-FIX-01/candidate-round-2.patch",
    "evidence_status": "pass",
    "final_state": null,
    "predeclared_expected_findings": [
      "missing upper-bound guard"
    ]
  },
  "outcome": "escalated",
  "permissions": {
    "desired": "read-only",
    "effective": "unverified",
    "enforcement": "manual frozen-evaluation host"
  },
  "plan_digest": "sha256:supplemental-v02-sup-fix-01-supplemental-baseline",
  "plan_revision": 1,
  "residual_risk": [
    "Reviewer independence is unverified; only the fixed oracle is measured."
  ],
  "result_digest": "sha256:a25dd3f3afb87447f0bbf1e4cb3828cbf8e369377f5c0037994c58e813b28420",
  "review_round": 2,
  "reviewer_identity": {
    "effective_model": null,
    "requested_model": null,
    "role": "reviewer",
    "verification": "unverified"
  },
  "run_id": "V02-SUP-FIX-01-supplemental-baseline",
  "schema_version": "1.0",
  "started_at": "2026-08-28T00:00:00Z",
  "task_contract_digest": "sha256:eb401dc1146d4f337bd07e45390aaf16bfe80d739419f4603e9bad604ee17b1f",
  "task_id": "V02-SUP-FIX-01.review-correction",
  "validation_summary": "Reviewed the named frozen candidate state and its bound worker result."
}
