{
  "criteria_verdicts": [
    {
      "criterion_id": "AC-1",
      "evidence": "Candidate requires disposition.",
      "status": "unverified"
    },
    {
      "criterion_id": "AC-2",
      "evidence": "Candidate requires disposition.",
      "status": "unverified"
    },
    {
      "criterion_id": "AC-3",
      "evidence": "Candidate requires disposition.",
      "status": "unverified"
    }
  ],
  "findings": [
    {
      "correction": "Provide only the bounded correction.",
      "disposition": "worker",
      "evidence": "deleted malformed-input test",
      "id": "F-ROUND-1",
      "impact": "Frozen candidate cannot satisfy the task.",
      "path": "evals/v0.2/supplemental/candidates/V02-SUP-REAL-003/candidate-round-1.patch",
      "severity": "high",
      "type": "acceptance-failure"
    }
  ],
  "finished_at": "2026-08-28T00:00:00Z",
  "metadata": {
    "artifact_origin": "frozen-candidate-replay",
    "bound_patch_digest": "sha256:c2e4b7a1325f5af01587d8187e3021b72f29cb85b8994e6776749116ae3cc03b",
    "bound_patch_path": "evals/v0.2/supplemental/candidates/V02-SUP-REAL-003/candidate-round-1.patch",
    "candidate_state": "evals/v0.2/supplemental/candidates/V02-SUP-REAL-003/candidate-round-1.patch",
    "predeclared_expected_findings": [
      "deleted malformed-input test"
    ]
  },
  "outcome": "changes_requested",
  "permissions": {
    "desired": "read-only",
    "effective": "unverified",
    "enforcement": "manual frozen-evaluation host"
  },
  "plan_digest": "sha256:supplemental-v02-sup-real-003-supplemental-baseline",
  "plan_revision": 1,
  "residual_risk": [
    "Reviewer independence is unverified; only the fixed oracle is measured."
  ],
  "result_digest": "sha256:2fa5c9ed9b2d0fcc1dcf6b9be364d7a02e533449004af290692b8bae65c6b56b",
  "review_round": 1,
  "reviewer_identity": {
    "effective_model": null,
    "requested_model": null,
    "role": "reviewer",
    "verification": "unverified"
  },
  "run_id": "V02-SUP-REAL-003-supplemental-baseline",
  "schema_version": "1.0",
  "started_at": "2026-08-28T00:00:00Z",
  "task_contract_digest": "sha256:75026c2d2ff5cd93528e1b4d556dc02123a5c1663cd0be2fb0b6acb5684bae81",
  "task_id": "V02-SUP-REAL-003.review-correction",
  "validation_summary": "Reviewed the named frozen candidate state and its bound worker result."
}
